{
  "id": "microsoft-graph-delta",
  "version": "0.1.0",
  "title": "Microsoft Graph Delta Enumeration Closure",
  "authority": "https://learn.microsoft.com/en-us/graph/delta-query-overview",
  "supportedOperation": "A Microsoft Graph delta-query page bound to the exact resource and query parameters.",
  "conservativeDefaults": {
    "missingCoverage": "unknown",
    "missingContinuation": "unknown",
    "unsupportedVariant": "fail_closed"
  },
  "references": [
    "https://learn.microsoft.com/en-us/graph/delta-query-overview"
  ],
  "notes": [
    "An empty page with @odata.nextLink is not exhausted.",
    "@odata.deltaLink marks completion of the current enumeration round, not eternal absence."
  ]
}
