{
  "id": "aws-dynamodb-query",
  "version": "0.1.0",
  "title": "Amazon DynamoDB Query Pagination Closure",
  "authority": "https://docs.aws.amazon.com/amazondynamodb/latest/developerguide/Query.Pagination.html",
  "supportedOperation": "A low-level DynamoDB Query response bound to the exact Query request.",
  "conservativeDefaults": {
    "missingCoverage": "unknown",
    "missingContinuation": "unknown",
    "unsupportedVariant": "fail_closed"
  },
  "references": [
    "https://docs.aws.amazon.com/amazondynamodb/latest/developerguide/Query.Pagination.html"
  ],
  "notes": [
    "A page can contain zero matching Items and still carry LastEvaluatedKey.",
    "The profile licenses a zero only after LastEvaluatedKey is absent."
  ]
}
