{
  "id": "elasticsearch-search-zero",
  "version": "0.1.0",
  "title": "Elasticsearch Exact-Zero Search Closure",
  "authority": "https://www.elastic.co/docs/api/doc/elasticsearch/operation/operation-search",
  "supportedOperation": "A non-scroll, non-search_after, non-terminate_after Elasticsearch search whose zero total is exact and whose shards all succeeded without timeout.",
  "conservativeDefaults": {
    "missingCoverage": "unknown",
    "missingContinuation": "unknown",
    "unsupportedVariant": "fail_closed"
  },
  "references": [
    "https://www.elastic.co/docs/api/doc/elasticsearch/operation/operation-search",
    "https://www.elastic.co/docs/solutions/search/the-search-api"
  ],
  "notes": [
    "timed_out, failed shards, a gte total relation, or unsupported request controls prevent a negative license."
  ]
}
